06_docking/scores/pose_sanity_scores.csv

candidate_id,pose_file,docking_score,num_ligand_atoms,ligand_centroid_x,ligand_centroid_y,ligand_centroid_z,grid_center_offset,min_protein_distance,contacts_within_4A,contacts_within_5A,unique_contact_residues_5A,contact_residues_5A,hard_clashes_lt_1_8A,pose_score,pose_decision,pose_image
CAND_baa376c0dd,C:\Users\srira\Desktop\new_plan\EMD_V5_2_Hybrid\06_docking\poses\CAND_baa376c0dd_vina_out.pdbqt,-9.186,315,29.354,12.64,-5.532,3.642,1.86,651,2411,33,ALA:A:880;ARG:A:938;ARG:A:980;ASN:A:859;ASN:A:981;ASP:A:939;ASP:A:976;ASP:A:994;GLN:A:853;GLN:A:854;GLU:A:1015;GLU:A:864;GLU:A:930;GLY:A:856;GLY:A:858;GLY:A:861;GLY:A:935;GLY:A:993;ILE:A:982;LEU:A:855;LEU:A:932;LEU:A:983;LYS:A:857;LYS:A:882;LYS:A:943;MET:A:929;PRO:A:933;SER:A:936;TYR:A:931;TYR:A:934,0,1.0,pass,C:\Users\srira\Desktop\new_plan\EMD_V5_2_Hybrid\06_docking\images\pose_sanity\CAND_baa376c0dd_pose.png
CAND_ab5598f4f0,C:\Users\srira\Desktop\new_plan\EMD_V5_2_Hybrid\06_docking\poses\CAND_ab5598f4f0_vina_out.pdbqt,-8.01,216,31.144,14.369,-4.348,1.834,2.048,523,1880,27,ALA:A:880;ARG:A:938;ARG:A:980;ASN:A:859;ASN:A:981;ASP:A:939;ASP:A:976;ASP:A:994;GLU:A:1015;GLU:A:930;GLY:A:856;GLY:A:858;GLY:A:861;GLY:A:935;GLY:A:993;ILE:A:982;LEU:A:855;LEU:A:932;LEU:A:983;LYS:A:857;LYS:A:882;MET:A:929;SER:A:862;SER:A:936;TYR:A:931;VAL:A:863;VAL:A:911,0,1.0,pass,C:\Users\srira\Desktop\new_plan\EMD_V5_2_Hybrid\06_docking\images\pose_sanity\CAND_ab5598f4f0_pose.png
CAND_cc70ad3aa7,C:\Users\srira\Desktop\new_plan\EMD_V5_2_Hybrid\06_docking\poses\CAND_cc70ad3aa7_vina_out.pdbqt,-7.648,270,31.082,12.434,-4.104,1.689,1.864,630,2449,24,ALA:A:880;ARG:A:938;ARG:A:980;ASN:A:981;ASP:A:939;ASP:A:994;GLU:A:930;GLY:A:856;GLY:A:858;GLY:A:935;GLY:A:993;LEU:A:855;LEU:A:932;LEU:A:983;LYS:A:857;LYS:A:882;MET:A:929;PRO:A:933;SER:A:862;SER:A:936;TYR:A:931;TYR:A:934;VAL:A:863;VAL:A:911,0,1.0,pass,C:\Users\srira\Desktop\new_plan\EMD_V5_2_Hybrid\06_docking\images\pose_sanity\CAND_cc70ad3aa7_pose.png
CAND_daf82c369e,C:\Users\srira\Desktop\new_plan\EMD_V5_2_Hybrid\06_docking\poses\CAND_daf82c369e_vina_out.pdbqt,-7.584,297,30.467,14.768,-5.0,2.791,2.264,605,2439,31,ALA:A:880;ARG:A:938;ARG:A:980;ASN:A:859;ASN:A:981;ASP:A:939;ASP:A:976;ASP:A:994;GLN:A:853;GLN:A:854;GLU:A:1015;GLU:A:930;GLY:A:856;GLY:A:858;GLY:A:861;GLY:A:935;GLY:A:993;GLY:A:996;LEU:A:855;LEU:A:932;LEU:A:983;LYS:A:857;LYS:A:882;MET:A:929;PHE:A:860;PRO:A:933;SER:A:862;SER:A:936;TYR:A:931;TYR:A:934,0,1.0,pass,C:\Users\srira\Desktop\new_plan\EMD_V5_2_Hybrid\06_docking\images\pose_sanity\CAND_daf82c369e_pose.png
CAND_3d3d2ca880,C:\Users\srira\Desktop\new_plan\EMD_V5_2_Hybrid\06_docking\poses\CAND_3d3d2ca880_vina_out.pdbqt,-7.396,208,30.11,15.832,-5.632,3.943,2.204,535,1912,33,ALA:A:880;ARG:A:938;ARG:A:980;ASN:A:859;ASN:A:981;ASP:A:939;ASP:A:976;ASP:A:994;GLN:A:853;GLN:A:854;GLU:A:1015;GLU:A:898;GLU:A:930;GLY:A:856;GLY:A:858;GLY:A:861;GLY:A:935;GLY:A:993;GLY:A:996;ILE:A:982;LEU:A:855;LEU:A:932;LEU:A:983;LEU:A:997;LYS:A:857;LYS:A:882;MET:A:929;PHE:A:860;SER:A:862;SER:A:936,0,1.0,pass,C:\Users\srira\Desktop\new_plan\EMD_V5_2_Hybrid\06_docking\images\pose_sanity\CAND_3d3d2ca880_pose.png
CAND_b5d4c77a0b,C:\Users\srira\Desktop\new_plan\EMD_V5_2_Hybrid\06_docking\poses\CAND_b5d4c77a0b_vina_out.pdbqt,-7.525,315,29.001,15.698,-5.821,4.709,1.882,703,2395,20,ARG:A:938;ARG:A:980;ASN:A:859;ASN:A:981;ASP:A:939;ASP:A:976;ASP:A:994;GLN:A:854;GLU:A:1015;GLY:A:856;GLY:A:858;GLY:A:861;GLY:A:935;GLY:A:993;LEU:A:855;LEU:A:983;LYS:A:857;LYS:A:882;SER:A:936;VAL:A:863,0,1.0,pass,C:\Users\srira\Desktop\new_plan\EMD_V5_2_Hybrid\06_docking\images\pose_sanity\CAND_b5d4c77a0b_pose.png
CAND_a2f01d5a38,C:\Users\srira\Desktop\new_plan\EMD_V5_2_Hybrid\06_docking\poses\CAND_a2f01d5a38_vina_out.pdbqt,-7.319,279,30.783,13.783,-4.583,1.958,2.156,551,2323,30,ALA:A:880;ARG:A:938;ARG:A:980;ASN:A:859;ASN:A:981;ASP:A:939;ASP:A:994;GLN:A:853;GLU:A:1015;GLU:A:930;GLY:A:856;GLY:A:858;GLY:A:861;GLY:A:935;GLY:A:993;GLY:A:996;LEU:A:855;LEU:A:932;LEU:A:983;LYS:A:857;LYS:A:882;LYS:A:943;MET:A:929;PHE:A:860;PRO:A:933;SER:A:936;TYR:A:931;TYR:A:934;VAL:A:863;VAL:A:911,0,1.0,pass,C:\Users\srira\Desktop\new_plan\EMD_V5_2_Hybrid\06_docking\images\pose_sanity\CAND_a2f01d5a38_pose.png
CAND_fa2553a110,C:\Users\srira\Desktop\new_plan\EMD_V5_2_Hybrid\06_docking\poses\CAND_fa2553a110_vina_out.pdbqt,-7.366,288,30.561,13.786,-4.727,2.211,1.913,638,2505,30,ALA:A:880;ARG:A:938;ARG:A:980;ASN:A:859;ASN:A:981;ASP:A:939;ASP:A:976;ASP:A:994;GLN:A:853;GLN:A:854;GLU:A:1015;GLU:A:930;GLY:A:856;GLY:A:858;GLY:A:861;GLY:A:935;GLY:A:993;GLY:A:996;ILE:A:982;LEU:A:855;LEU:A:932;LEU:A:983;LYS:A:857;LYS:A:882;MET:A:929;PRO:A:933;SER:A:862;SER:A:936;TYR:A:931;VAL:A:863,0,1.0,pass,C:\Users\srira\Desktop\new_plan\EMD_V5_2_Hybrid\06_docking\images\pose_sanity\CAND_fa2553a110_pose.png
CAND_577f2e4a02,C:\Users\srira\Desktop\new_plan\EMD_V5_2_Hybrid\06_docking\poses\CAND_577f2e4a02_vina_out.pdbqt,-7.219,297,30.156,14.475,-5.195,2.977,1.987,669,2531,31,ALA:A:880;ARG:A:938;ARG:A:980;ASN:A:981;ASP:A:939;ASP:A:976;ASP:A:994;GLN:A:853;GLN:A:854;GLU:A:1015;GLU:A:930;GLY:A:856;GLY:A:858;GLY:A:861;GLY:A:935;GLY:A:993;GLY:A:996;ILE:A:982;LEU:A:855;LEU:A:932;LEU:A:983;LEU:A:997;LYS:A:857;LYS:A:882;MET:A:929;PRO:A:933;SER:A:862;SER:A:936;TYR:A:931;VAL:A:863,0,1.0,pass,C:\Users\srira\Desktop\new_plan\EMD_V5_2_Hybrid\06_docking\images\pose_sanity\CAND_577f2e4a02_pose.png
CAND_bd9a5bcc10,C:\Users\srira\Desktop\new_plan\EMD_V5_2_Hybrid\06_docking\poses\CAND_bd9a5bcc10_vina_out.pdbqt,-6.899,180,30.602,15.987,-5.022,3.527,2.439,424,1636,22,ARG:A:938;ARG:A:980;ASN:A:859;ASN:A:981;ASP:A:939;ASP:A:976;ASP:A:994;GLU:A:1015;GLY:A:856;GLY:A:858;GLY:A:861;GLY:A:935;GLY:A:993;GLY:A:996;ILE:A:982;LEU:A:855;LEU:A:983;LYS:A:857;LYS:A:882;SER:A:862;SER:A:936;VAL:A:863,0,1.0,pass,C:\Users\srira\Desktop\new_plan\EMD_V5_2_Hybrid\06_docking\images\pose_sanity\CAND_bd9a5bcc10_pose.png

explanation for review/reports/EMD_V5_2_Hybrid_Final_Report_Draft.md

### Rank 1: CAND_baa376c0dd

- Source: selfies
- SMILES: `C=Cc1ccccc1C(N)C=C1C=NC2=NN1CN1CCN(CC1)c1ccc(cc1F)N2`
- Docking score: -9.186 kcal/mol
- Final weighted score: 0.922314
- Decision: primary_candidate
- Main risk: no_major_descriptor_risk

### Rank 2: CAND_ab5598f4f0

- Source: selfies
- SMILES: `ClCCNC1=C=Nn2cccc2C2C=CC(=NN2)NC=N1`
- Docking score: -8.01 kcal/mol
- Final weighted score: 0.855059
- Decision: primary_candidate
- Main risk: no_major_descriptor_risk

### Rank 3: CAND_cc70ad3aa7

- Source: selfies
- SMILES: `NC1SN2C=CC3=NC2=C1c1cc(ncn1)NCC=CC=C(F)C=C3`
- Docking score: -7.648 kcal/mol
- Final weighted score: 0.836428
- Decision: primary_candidate
- Main risk: no_major_descriptor_risk

### Rank 4: CAND_daf82c369e

- Source: selfies
- SMILES: `CC1C=NC=C(F)CN=c2nc(Cl)ccc2=C(NC=C2N=CCCN2)N=CN1`
- Docking score: -7.584 kcal/mol
- Final weighted score: 0.822479
- Decision: primary_candidate
- Main risk: no_major_descriptor_risk

### Rank 5: CAND_3d3d2ca880

- Source: selfies
- SMILES: `CS(=O)(=O)n1cnnc(NN=CF)ncccccc2cccnc21`
- Docking score: -7.396 kcal/mol
- Final weighted score: 0.82203
- Decision: primary_candidate
- Main risk: no_major_descriptor_risk